{"$schema":"https://json-schema.org/draft/2020-12/schema","$id":"https://gist.local/contracts/registry/v1/execution-schema.schema.json","type":"object","additionalProperties":false,"required":["id","version","dialect","input_schema","output_schema","provider_action","execution_location","credentials","destinations","provenance","capture_time","digest","lifecycle"],"properties":{"id":{"type":"string"},"version":{"type":"string"},"dialect":{"const":"https://json-schema.org/draft/2020-12/schema"},"input_schema":{"type":"object"},"output_schema":{"type":"object"},"provider_action":{"type":"object","additionalProperties":false,"required":["id","version"],"properties":{"id":{"type":"string"},"version":{"type":"string"}}},"execution_location":{"enum":["client","runtime","gist_gateway"]},"credentials":{"type":"object","additionalProperties":false,"required":["type","scopes"],"properties":{"type":{"type":"string"},"scopes":{"type":"array","items":{"type":"string"}}}},"destinations":{"type":"array","items":{"type":"string","format":"uri"}},"provenance":{"type":"string"},"capture_time":{"type":"string","format":"date-time"},"digest":{"$ref":"https://gist.local/contracts/registry/v1/common.schema.json#/$defs/digest"},"lifecycle":{"enum":["draft","published","deprecated","revoked"]}}}
