[{"id":"composio/identity-user-create","version":"2026-09-25","dialect":"https://json-schema.org/draft/2020-12/schema","input_schema":{"type":"object"},"output_schema":{"type":"object"},"provider_action":{"id":"composio.synthetic.identity.user.create","version":"catalog-1"},"execution_location":"client","credentials":{"type":"oauth2","scopes":["users:write"]},"destinations":["https://backend.composio.dev"],"provenance":"https://docs.composio.dev/docs/intro; documentation lookup returned 404 on 2026-09-25","capture_time":"2026-09-25T00:00:00Z","digest":{"algorithm":"sha256","value":"16283d6a347481623de9bd6d9f1326052a4fe565f24dd555f6cdb0e5e474030e"},"lifecycle":"published"},{"id":"github-mcp-server/communication-message-send","version":"0.1.0","dialect":"https://json-schema.org/draft/2020-12/schema","input_schema":{"type":"object"},"output_schema":{"type":"object"},"provider_action":{"id":"github.mcp.catalog.issue-comment.create","version":"main-2026-09-25"},"execution_location":"client","credentials":{"type":"oauth2","scopes":["repo"]},"destinations":["https://api.github.com"],"provenance":"https://github.com/github/github-mcp-server/raw/main/README.md","capture_time":"2026-09-25T00:00:00Z","digest":{"algorithm":"sha256","value":"c5dd75e20548ea30157d4cabf1e395195879dfe6c4a89fc5df726e08d2230185"},"lifecycle":"published"},{"id":"slack-web-api/document-parse","version":"2026-09-25","dialect":"https://json-schema.org/draft/2020-12/schema","input_schema":{"type":"object"},"output_schema":{"type":"object"},"provider_action":{"id":"files.info","version":"web-api-current"},"execution_location":"client","credentials":{"type":"oauth2","scopes":["files:read"]},"destinations":["https://slack.com/api"],"provenance":"https://api.slack.com/web; https://api.slack.com/methods","capture_time":"2026-09-25T00:00:00Z","digest":{"algorithm":"sha256","value":"ab129311a702d181ead4ac7bf3e499c812952986f8e9560f5ac69161cab23a83"},"lifecycle":"published"}]
